{"$schema":"./root-image-manifest.schema.json","artifacts":{"kernelWasm":{"bytes":569554,"path":"doc/wasm/js/wasmcl.wasm","sha256":"7bdb13546cd8ce93fcae3ee0b3092f9fdeb358aecad4eb8b2411f35be5d95db1"},"rootImage":{"bytes":380944,"path":"doc/wasm/root.image","sha256":"0b0da3ec39a7b39f8ceb71cb6a8855d230dacb8dfaceb43e1e5438ac91f15a4b"},"runtimeModulesBinary":{"bytes":101249073,"path":"doc/wasm/wasm-runtime-modules.bin","sha256":"10f187caa4abecba77884e593b77efe964173c4d36248f44e286575bf4a106d5"},"runtimeModulesIndex":{"bytes":122467,"path":"doc/wasm/wasm-runtime-modules.idx","sha256":"0e047017dc5b511c0acae0e34b7c91f9b285c6aa30ec79ece2870a72e495d938"},"runtimeModulesManifest":{"bytes":334,"constPoolCount":5438,"format":"ccl-wasm-modules-v2","moduleCount":7620,"path":"doc/wasm/wasm-runtime-modules.json","sha256":"b7262383b92f1494fd01d138ecd38b25f184659b6863e0721bcc873d23bf4460"},"subprimsWasm":{"bytes":280409,"path":"doc/wasm/js/subprims.wasm","sha256":"2f45f53cb0838de5cd9722f45c69eacdee89a35371149609ccb5966325641aec"}},"build":{"arch":"x64","nodeVersion":"v25.6.0","platform":"darwin","tool":"doc/wasm/js/make-real-image.mjs"},"generatedAt":"2026-02-10T19:27:03.341Z","policy":{"compiledModulesRequired":true,"entrypointIndex":200,"expectedLoaderMode":"start-lisp"},"schemaVersion":1}
